{
  "$schema": "https://json-schema.org/draft/2020-12/schema",
  "$id": "https://cdx.dev/schemas/precise-layout.schema.json",
  "title": "CDX Precise Layout",
  "description": "Schema for precise layout files (presentation/layouts/*.json) in a CDX document. Required for FROZEN and PUBLISHED documents that assert page-precise fidelity; recommended otherwise.",
  "type": "object",
  "required": ["version", "presentationType", "targetFormat", "pageSize", "contentHash", "generatedAt", "pages"],
  "properties": {
    "version": {
      "type": "string",
      "description": "Layout format version",
      "pattern": "^\\d+\\.\\d+$"
    },
    "presentationType": {
      "type": "string",
      "description": "Must be 'precise'",
      "const": "precise"
    },
    "targetFormat": {
      "type": "string",
      "description": "Page format name (letter, a4, legal, custom)"
    },
    "pageSize": {
      "type": "object",
      "required": ["width", "height"],
      "properties": {
        "width": {
          "type": "string",
          "description": "Page width with unit"
        },
        "height": {
          "type": "string",
          "description": "Page height with unit"
        }
      },
      "additionalProperties": false
    },
    "contentHash": {
      "description": "Hash of content when layout was generated. Must match current content hash for FROZEN/PUBLISHED.",
      "$ref": "https://cdx.dev/schemas/anchor.schema.json#/$defs/contentHash"
    },
    "generatedAt": {
      "type": "string",
      "description": "ISO 8601 timestamp when layout was generated",
      "format": "date-time"
    },
    "pageTemplate": {
      "$ref": "#/$defs/pageTemplate"
    },
    "pages": {
      "type": "array",
      "description": "Array of page definitions with precisely positioned elements",
      "items": {
        "$ref": "#/$defs/page"
      },
      "minItems": 1
    },
    "fonts": {
      "type": "object",
      "description": "Font metrics for exact text reproduction",
      "additionalProperties": {
        "$ref": "#/$defs/fontMetrics"
      }
    }
  },
  "additionalProperties": false,
  "$defs": {
    "page": {
      "type": "object",
      "required": ["number", "elements"],
      "properties": {
        "number": {
          "type": "integer",
          "minimum": 1,
          "description": "Page number"
        },
        "elements": {
          "type": "array",
          "items": {
            "$ref": "#/$defs/preciseElement"
          }
        }
      },
      "additionalProperties": false
    },
    "preciseElement": {
      "type": "object",
      "required": ["blockId", "x", "y", "width", "height"],
      "properties": {
        "blockId": {
          "type": "string",
          "description": "Reference to content block ID"
        },
        "x": {
          "type": "string",
          "description": "Horizontal position from left edge"
        },
        "y": {
          "type": "string",
          "description": "Vertical position from top edge"
        },
        "width": {
          "type": "string",
          "description": "Element width"
        },
        "height": {
          "type": "string",
          "description": "Element height"
        },
        "continues": {
          "type": "boolean",
          "description": "True if element continues to next page"
        },
        "continuation": {
          "type": "boolean",
          "description": "True if element is continued from previous page"
        },
        "zIndex": {
          "type": "integer",
          "description": "Stacking order (higher values render on top)"
        },
        "transform": {
          "$ref": "#/$defs/transform"
        },
        "lines": {
          "type": "array",
          "description": "Line-level coordinates for legal/court documents",
          "items": {
            "$ref": "#/$defs/linePrecision"
          }
        }
      },
      "additionalProperties": false
    },
    "transform": {
      "type": "object",
      "description": "Transform properties for rotation, scaling, and skewing",
      "properties": {
        "rotate": {
          "type": "string",
          "description": "Rotation angle (e.g., '90deg', '-45deg', '0.5rad', '0.25turn')"
        },
        "scale": {
          "oneOf": [
            { "type": "number", "description": "Uniform scale factor" },
            {
              "type": "object",
              "properties": {
                "x": { "type": "number" },
                "y": { "type": "number" }
              },
              "required": ["x", "y"],
              "additionalProperties": false
            }
          ]
        },
        "skewX": {
          "type": "string",
          "description": "Horizontal skew angle"
        },
        "skewY": {
          "type": "string",
          "description": "Vertical skew angle"
        },
        "translateX": {
          "type": "string",
          "description": "Horizontal translation"
        },
        "translateY": {
          "type": "string",
          "description": "Vertical translation"
        },
        "matrix": {
          "type": "array",
          "items": { "type": "number" },
          "minItems": 6,
          "maxItems": 6,
          "description": "Full 2D transform matrix [a, b, c, d, tx, ty]"
        },
        "origin": {
          "oneOf": [
            { "type": "string", "description": "Transform origin (e.g., 'center', 'top left')" },
            {
              "type": "object",
              "properties": {
                "x": { "type": "string" },
                "y": { "type": "string" }
              },
              "required": ["x", "y"],
              "additionalProperties": false
            }
          ]
        }
      },
      "additionalProperties": false
    },
    "linePrecision": {
      "type": "object",
      "required": ["number", "y", "height"],
      "properties": {
        "number": {
          "type": "integer",
          "minimum": 1,
          "description": "Line number"
        },
        "y": {
          "type": "string",
          "description": "Vertical position of line"
        },
        "height": {
          "type": "string",
          "description": "Line height"
        }
      },
      "additionalProperties": false
    },
    "pageTemplate": {
      "type": "object",
      "properties": {
        "margins": {
          "type": "object",
          "properties": {
            "top": { "type": "string" },
            "bottom": { "type": "string" },
            "left": { "type": "string" },
            "right": { "type": "string" }
          },
          "additionalProperties": false
        },
        "header": {
          "$ref": "#/$defs/headerFooter"
        },
        "footer": {
          "$ref": "#/$defs/headerFooter"
        }
      },
      "additionalProperties": false
    },
    "headerFooter": {
      "type": "object",
      "properties": {
        "content": {
          "type": "string",
          "description": "Text content with optional variables like {pageNumber}"
        },
        "style": {
          "type": "string",
          "description": "Named style to apply"
        },
        "y": {
          "type": "string",
          "description": "Vertical position"
        }
      },
      "additionalProperties": false
    },
    "fontMetrics": {
      "type": "object",
      "required": ["family", "style", "weight"],
      "properties": {
        "family": {
          "type": "string",
          "description": "Font family name"
        },
        "style": {
          "type": "string",
          "description": "Font style (normal, italic)"
        },
        "weight": {
          "type": "integer",
          "minimum": 100,
          "maximum": 900,
          "description": "Font weight"
        },
        "unitsPerEm": {
          "type": "integer",
          "description": "Units per em square"
        },
        "ascender": {
          "type": "integer",
          "description": "Ascender height in font units"
        },
        "descender": {
          "type": "integer",
          "description": "Descender depth in font units (typically negative)"
        }
      },
      "additionalProperties": false
    }
  }
}
